{"$schema":"https://json-schema.org/draft/2020-12/schema","$id":"https://kdtp.local/schemas/release/v3/m2-portable-release-readiness.schema.json","title":"M2 Portable Release Readiness v1","type":"object","additionalProperties":false,"required":["schemaVersion","releaseId","version","phase","contractBaseSha","releaseSourceSha","immutableImage","repositoryVerification","historicalEvidence","runtimeConfiguration","repositoryNonRequirements","deploymentOperatorResponsibilities","decision"],"properties":{"schemaVersion":{"const":"m2-portable-release-readiness/v1"},"releaseId":{"const":"M2-RC1"},"version":{"const":"0.12.0"},"phase":{"const":"PORTABLE_RELEASE_READINESS"},"contractBaseSha":{"type":"string","pattern":"^[a-f0-9]{40}$"},"releaseSourceSha":{"type":"string","pattern":"^[a-f0-9]{40}$"},"immutableImage":{"$ref":"#/$defs/immutableImage"},"repositoryVerification":{"$ref":"#/$defs/repositoryVerification"},"historicalEvidence":{"$ref":"#/$defs/historicalEvidence"},"runtimeConfiguration":{"$ref":"#/$defs/runtimeConfiguration"},"repositoryNonRequirements":{"type":"array","minItems":5,"uniqueItems":true,"items":{"type":"string","minLength":4}},"deploymentOperatorResponsibilities":{"type":"array","minItems":5,"uniqueItems":true,"items":{"type":"string","minLength":4}},"decision":{"$ref":"#/$defs/decision"}},"$defs":{"sha256":{"type":"string","pattern":"^sha256:[a-f0-9]{64}$"},"immutableImage":{"type":"object","additionalProperties":false,"required":["reference","digest","releaseWorkflowRunId","sbomDigest","provenanceAttestationId","sbomAttestationId"],"properties":{"reference":{"type":"string","pattern":"^ghcr\\.io/.+@sha256:[a-f0-9]{64}$"},"digest":{"$ref":"#/$defs/sha256"},"releaseWorkflowRunId":{"type":"integer","minimum":1},"sbomDigest":{"$ref":"#/$defs/sha256"},"provenanceAttestationId":{"type":"string","pattern":"^[0-9]+$"},"sbomAttestationId":{"type":"string","pattern":"^[0-9]+$"}}},"repositoryVerification":{"type":"object","additionalProperties":false,"required":["mainPushValidationRunId","independentR2AValidationRunId","postMergeObservationRunId","postMergeObservationArtifactId","postMergeObservationArtifactDigest"],"properties":{"mainPushValidationRunId":{"type":"integer","minimum":1},"independentR2AValidationRunId":{"type":"integer","minimum":1},"postMergeObservationRunId":{"type":"integer","minimum":1},"postMergeObservationArtifactId":{"type":"integer","minimum":1},"postMergeObservationArtifactDigest":{"$ref":"#/$defs/sha256"}}},"historicalReference":{"type":"object","additionalProperties":false,"required":["path","canonicalDigest"],"properties":{"path":{"type":"string","minLength":4},"canonicalDigest":{"$ref":"#/$defs/sha256"}}},"historicalRoleReference":{"type":"object","additionalProperties":false,"required":["path","canonicalDigest","role"],"properties":{"path":{"type":"string","minLength":4},"canonicalDigest":{"$ref":"#/$defs/sha256"},"role":{"type":"string","minLength":4}}},"historicalEvidence":{"type":"object","additionalProperties":false,"required":["productionPromotion","externalEvidenceIntake","imageBinding","deploymentManifest"],"properties":{"productionPromotion":{"$ref":"#/$defs/historicalRoleReference"},"externalEvidenceIntake":{"$ref":"#/$defs/historicalRoleReference"},"imageBinding":{"$ref":"#/$defs/historicalReference"},"deploymentManifest":{"$ref":"#/$defs/historicalReference"}}},"runtimeInput":{"type":"object","additionalProperties":false,"required":["name","classification","repositoryValueAllowed","deliveryMechanisms"],"properties":{"name":{"type":"string","pattern":"^KDTP_[A-Z0-9_]+$"},"classification":{"enum":["SENSITIVE_OR_IDENTITY_BOUND","NON_SECRET_CONFIGURATION","SECURITY_CONFIGURATION"]},"repositoryValueAllowed":{"type":"boolean"},"deliveryMechanisms":{"type":"array","minItems":1,"uniqueItems":true,"items":{"type":"string","minLength":4}}}},"placeholder":{"type":"object","additionalProperties":false,"required":["name","path","mustBeReplacedByOperator"],"properties":{"name":{"type":"string","pattern":"^KDTP_[A-Z0-9_]+$"},"path":{"type":"string","minLength":4},"mustBeReplacedByOperator":{"const":true}}},"runtimeConfiguration":{"type":"object","additionalProperties":false,"required":["deliveryModel","providerAgnostic","repositoryStoresSecretValues","repositoryRequiresProviderMetadata","configMapRefName","secretRefName","requiredInputs","placeholders"],"properties":{"deliveryModel":{"const":"OPERATOR_SUPPLIED"},"providerAgnostic":{"const":true},"repositoryStoresSecretValues":{"const":false},"repositoryRequiresProviderMetadata":{"const":false},"configMapRefName":{"type":"string","minLength":4},"secretRefName":{"type":"string","minLength":4},"requiredInputs":{"type":"array","minItems":5,"uniqueItems":true,"items":{"$ref":"#/$defs/runtimeInput"}},"placeholders":{"type":"array","minItems":2,"uniqueItems":true,"items":{"$ref":"#/$defs/placeholder"}}}},"decision":{"type":"object","additionalProperties":false,"required":["repositoryReleaseReady","environmentPromotionEvaluated","environmentPromotionEligible","repositoryBlockers","deploymentOperatorGates"],"properties":{"repositoryReleaseReady":{"const":true},"environmentPromotionEvaluated":{"const":false},"environmentPromotionEligible":{"type":"null"},"repositoryBlockers":{"type":"array","maxItems":0},"deploymentOperatorGates":{"type":"array","minItems":4,"uniqueItems":true,"items":{"type":"string","minLength":4}}}}}}
